{
  "asset_schema_version": 1,
  "name": "kimi-k2-k3-native",
  "precision": "fp8",
  "operator_precisions": {
    "attention": "bf16",
    "attention_core": "fp8",
    "dense": "bf16",
    "routed_expert_weight": "mxfp4",
    "routed_expert_activation": "mxfp8",
    "latent_moe_projection_weight": "bf16",
    "latent_moe_projection_activation": "bf16",
    "shared_expert_weight": "bf16",
    "shared_expert_activation": "bf16",
    "router_weight_storage": "bf16",
    "moe_router_activation": "bf16",
    "router_compute": "fp32",
    "lm_head": "bf16",
    "kv_cache": "fp8",
    "kda_snapshot": "bf16"
  }
}
