{
  "asset_schema_version": 1,
  "name": "kimi-k3-w4a8",
  "precision": "fp8",
  "operator_precisions": {
    "attention": "fp8",
    "dense": "fp8",
    "moe_expert": "fp8",
    "moe_router": "fp8",
    "kv_cache": "fp8",
    "communication": "fp8",
    "attention_weight": "fp8",
    "attention_activation": "fp8",
    "dense_weight": "fp8",
    "dense_activation": "fp8",
    "moe_expert_weight": "fp4",
    "moe_expert_activation": "fp8",
    "moe_router_weight": "fp8",
    "moe_router_activation": "fp8",
    "router_weight_storage": "fp8",
    "lm_head": "fp8",
    "lm_head_weight": "fp8",
    "lm_head_activation": "fp8",
    "routed_expert_weight": "fp4",
    "routed_expert_activation": "fp8",
    "latent_moe_projection_weight": "fp4",
    "latent_moe_projection_activation": "fp8",
    "shared_expert_weight": "fp4",
    "shared_expert_activation": "fp8",
    "dense_mlp_weight": "fp8",
    "dense_mlp_activation": "fp8",
    "router_compute": "fp8",
    "kda_snapshot": "fp8"
  }
}
